{
  "$schema": "../../schema/component-family.generated.schema.json",
  "family": "progress-bar",
  "generationStatus": "generated",
  "links": {
    "referenceDocs": [
      "docs/reference/architecture.md",
      "docs/reference/spec.md",
      "docs/reference/ai-metadata.md",
      "docs/reference/testing.md",
      "docs/reference/governance.md"
    ],
    "guides": ["docs/guides/adding-components.md", "docs/guides/figma-to-marwes.md"],
    "audits": ["docs/audits/README.md"],
    "roadmap": [],
    "core": [
      "packages/core/src/components/atoms/progress-bar/index.ts",
      "packages/core/src/components/atoms/progress-bar/progress-bar-a11y.ts",
      "packages/core/src/components/atoms/progress-bar/progress-bar-html-attributes.ts",
      "packages/core/src/components/atoms/progress-bar/progress-bar-recipe.ts",
      "packages/core/src/components/atoms/progress-bar/progress-bar-types.ts"
    ],
    "presets": ["packages/presets/src/firstEdition/progress-bar.css"],
    "react": [
      "packages/react/src/components/progress-bar/__tests__/index-exports.test.tsx",
      "packages/react/src/components/progress-bar/__tests__/progress-bar.test.tsx",
      "packages/react/src/components/progress-bar/index.ts",
      "packages/react/src/components/progress-bar/progress-bar.tsx"
    ],
    "vue": [
      "packages/vue/src/components/progress-bar/__tests__/index-exports.test.ts",
      "packages/vue/src/components/progress-bar/__tests__/progress-bar.test.ts",
      "packages/vue/src/components/progress-bar/index.ts",
      "packages/vue/src/components/progress-bar/progress-bar.ts"
    ],
    "svelte": [
      "packages/svelte/src/lib/components/progress-bar/index.ts",
      "packages/svelte/src/lib/components/progress-bar/ProgressBar.svelte",
      "packages/svelte/src/lib/components/progress-bar/types.ts"
    ],
    "storybookReact": [
      "apps/storybook-react/src/stories/progress-bar/__tests__/progress-bar-introduction-docs.test.ts",
      "apps/storybook-react/src/stories/progress-bar/__tests__/progress-bar-taxonomy.test.ts",
      "apps/storybook-react/src/stories/progress-bar/Introduction.mdx",
      "apps/storybook-react/src/stories/progress-bar/progress-bar.stories.tsx"
    ],
    "storybookVue": [
      "apps/storybook-vue/src/stories/progress-bar/__tests__/progress-bar-introduction-docs.test.ts",
      "apps/storybook-vue/src/stories/progress-bar/__tests__/progress-bar-taxonomy.test.ts",
      "apps/storybook-vue/src/stories/progress-bar/Introduction.mdx",
      "apps/storybook-vue/src/stories/progress-bar/progress-bar.stories.ts"
    ],
    "storybookSvelte": [
      "apps/storybook-svelte/src/stories/progress-bar/__tests__/progress-bar-taxonomy-introduction-docs.test.ts",
      "apps/storybook-svelte/src/stories/progress-bar/Introduction.mdx",
      "apps/storybook-svelte/src/stories/progress-bar/progress-bar.stories.ts",
      "apps/storybook-svelte/src/stories/progress-bar/ProgressBarShowcase.svelte"
    ],
    "contracts": ["tests/contracts/progress-bar.contract.ts"]
  },
  "semantics": {
    "coverageLevel": "family-local",
    "dataComponent": "progress-bar",
    "canonicalAttributes": [],
    "allowedPurposes": [],
    "purposeAttributes": {},
    "sourceOfTruthPaths": [
      "packages/core/src/components/atoms/progress-bar/progress-bar-recipe.ts"
    ],
    "notes": [
      "ProgressBar is not part of the wave-1 canonical semantic registry in @marwes-ui/core.",
      "The atom emits data-component=progress-bar plus local size, state, and disabled attributes from core."
    ]
  },
  "design": {
    "componentJsons": [".figma/marwes/components/progress-bar.json"],
    "curatedReferences": [
      ".figma/INDEX.md",
      ".figma/NODE_REFERENCE.md",
      ".figma/nodes.json",
      ".figma/marwes/components/_index.json",
      ".figma/marwes/manifest.json",
      ".figma/marwes/README.md"
    ],
    "pageReferences": [
      ".figma/marwes/pages/-progress-bar/-progress-bar_1727-3932.json",
      ".figma/marwes/pages/-progress-bar/-progress-bar-dark_1727-4018.json"
    ],
    "nodeReferences": {
      "progressBarComponent": "1727:3852",
      "progressBarLightFrame": "1727:3932",
      "progressBarDarkFrame": "1727:4018"
    },
    "figmaTokens": [],
    "figmaStates": {
      "baseVariants": ["progress-bar", "small", "default"],
      "interactionStates": [
        "default",
        "hover",
        "pressed",
        "disabled",
        "focus",
        "label",
        "percentage"
      ]
    }
  },
  "coverage": {
    "react": true,
    "vue": true,
    "svelte": true,
    "storybookReact": true,
    "storybookVue": true,
    "storybookSvelte": true,
    "contractsPresent": true,
    "auditDocPresent": false,
    "figmaReferencesPresent": true
  },
  "notes": [
    "ProgressBar is not part of the wave-1 canonical semantic registry in @marwes-ui/core.",
    "The atom emits data-component=progress-bar plus local size, state, and disabled attributes from core.",
    "Generated from docs/registry/families/progress-bar/registry.meta.json and scripts/generate-component-registry.ts."
  ]
}
