{
  "$schema": "../../schema/component-family.generated.schema.json",
  "family": "radio",
  "generationStatus": "generated",
  "links": {
    "referenceDocs": [
      "docs/reference/architecture.md",
      "docs/reference/spec.md",
      "docs/reference/ai-metadata.md",
      "docs/reference/testing.md",
      "docs/reference/governance.md"
    ],
    "guides": ["docs/guides/adding-components.md", "docs/guides/figma-to-marwes.md"],
    "audits": ["docs/audits/README.md", "docs/audits/radio-family-accessibility.md"],
    "roadmap": [
      "AXE_ROADMAP.md#phase-5--add-a-first-class-accessibility-support-model",
      "AXE_ROADMAP.md#p3--follow-up-family-and-system-work"
    ],
    "core": [
      "packages/core/src/components/atoms/radio/index.ts",
      "packages/core/src/components/atoms/radio/radio-a11y.ts",
      "packages/core/src/components/atoms/radio/radio-html-attributes.ts",
      "packages/core/src/components/atoms/radio/radio-recipe.ts",
      "packages/core/src/components/atoms/radio/radio-types.ts"
    ],
    "presets": [
      "packages/presets/src/firstEdition/radio.css",
      "packages/presets/src/firstEdition/molecules/radio-group-field.css"
    ],
    "react": [
      "packages/react/src/components/radio/__tests__/radio-group-field-wiring-update-hydration.test.tsx",
      "packages/react/src/components/radio/__tests__/radio-group-field.test.tsx",
      "packages/react/src/components/radio/__tests__/radio-group-update-hydration.test.tsx",
      "packages/react/src/components/radio/__tests__/radio.test.tsx",
      "packages/react/src/components/radio/__tests__/variants.test.tsx",
      "packages/react/src/components/radio/index.ts",
      "packages/react/src/components/radio/radio-group-field.tsx",
      "packages/react/src/components/radio/radio.tsx",
      "packages/react/src/components/radio/variants.tsx"
    ],
    "vue": [
      "packages/vue/src/components/radio/__tests__/callback-single-fire.test.ts",
      "packages/vue/src/components/radio/__tests__/radio-group-field-wiring-update-hydration.test.ts",
      "packages/vue/src/components/radio/__tests__/radio-group-field.test.ts",
      "packages/vue/src/components/radio/__tests__/radio-group-update-hydration.test.ts",
      "packages/vue/src/components/radio/__tests__/radio.test.ts",
      "packages/vue/src/components/radio/__tests__/variants.test.ts",
      "packages/vue/src/components/radio/index.ts",
      "packages/vue/src/components/radio/radio-group-field.ts",
      "packages/vue/src/components/radio/radio.ts",
      "packages/vue/src/components/radio/variants.ts"
    ],
    "svelte": [
      "packages/svelte/src/lib/components/radio/index.ts",
      "packages/svelte/src/lib/components/radio/OptionRadioGroup.svelte",
      "packages/svelte/src/lib/components/radio/Radio.svelte",
      "packages/svelte/src/lib/components/radio/RadioGroupField.svelte",
      "packages/svelte/src/lib/components/radio/RatingRadioGroup.svelte",
      "packages/svelte/src/lib/components/radio/types.ts",
      "packages/svelte/src/lib/components/radio/YesNoRadioGroup.svelte"
    ],
    "storybookReact": [
      "apps/storybook-react/src/stories/radio/__tests__/radio-introduction-docs.test.ts",
      "apps/storybook-react/src/stories/radio/__tests__/radio-taxonomy.test.ts",
      "apps/storybook-react/src/stories/radio/Introduction.mdx",
      "apps/storybook-react/src/stories/radio/option-radio-group.stories.tsx",
      "apps/storybook-react/src/stories/radio/radio-group-field.stories.tsx",
      "apps/storybook-react/src/stories/radio/radio.stories.tsx",
      "apps/storybook-react/src/stories/radio/rating-radio-group.stories.tsx",
      "apps/storybook-react/src/stories/radio/yes-no-radio-group.stories.tsx"
    ],
    "storybookVue": [
      "apps/storybook-vue/src/stories/radio/__tests__/radio-introduction-docs.test.ts",
      "apps/storybook-vue/src/stories/radio/__tests__/radio-taxonomy.test.ts",
      "apps/storybook-vue/src/stories/radio/Introduction.mdx",
      "apps/storybook-vue/src/stories/radio/option-radio-group.stories.ts",
      "apps/storybook-vue/src/stories/radio/radio-group-field.stories.ts",
      "apps/storybook-vue/src/stories/radio/radio.stories.ts",
      "apps/storybook-vue/src/stories/radio/rating-radio-group.stories.ts",
      "apps/storybook-vue/src/stories/radio/yes-no-radio-group.stories.ts"
    ],
    "storybookSvelte": [
      "apps/storybook-svelte/src/stories/radio/__tests__/radio-introduction-docs.test.ts",
      "apps/storybook-svelte/src/stories/radio/__tests__/radio-taxonomy.test.ts",
      "apps/storybook-svelte/src/stories/radio/Introduction.mdx",
      "apps/storybook-svelte/src/stories/radio/option-radio-group.stories.ts",
      "apps/storybook-svelte/src/stories/radio/radio-group-field.stories.ts",
      "apps/storybook-svelte/src/stories/radio/radio.stories.ts",
      "apps/storybook-svelte/src/stories/radio/RadioGroupFieldStory.svelte",
      "apps/storybook-svelte/src/stories/radio/RadioShowcase.svelte",
      "apps/storybook-svelte/src/stories/radio/rating-radio-group.stories.ts",
      "apps/storybook-svelte/src/stories/radio/yes-no-radio-group.stories.ts"
    ],
    "contracts": ["tests/contracts/radio.contract.ts"]
  },
  "semantics": {
    "coverageLevel": "family-local",
    "dataComponent": null,
    "canonicalAttributes": [],
    "allowedPurposes": ["binary-choice", "rating", "selection"],
    "purposeAttributes": {
      "binary-choice": {
        "data-purpose": "binary-choice"
      },
      "rating": {
        "data-purpose": "rating"
      },
      "selection": {
        "data-purpose": "selection"
      }
    },
    "sourceOfTruthPaths": [
      "packages/core/src/shared/field-helpers.ts",
      "packages/react/src/components/radio/radio-group-field.tsx",
      "packages/react/src/components/radio/variants.tsx",
      "packages/vue/src/components/radio/radio-group-field.ts",
      "packages/vue/src/components/radio/variants.ts"
    ],
    "notes": [
      "Radio is not part of the wave-1 canonical semantic registry in @marwes-ui/core.",
      "Family-local purpose metadata currently lives in the React and Vue purpose-radio wrappers, while the raw atom and group field rely on native input[type=radio], role=radiogroup, and shared field-helper wiring."
    ]
  },
  "design": {
    "componentJsons": [
      ".figma/marwes/components/radio-button.json",
      ".figma/marwes/components/radio-group.json"
    ],
    "curatedReferences": [
      ".figma/INDEX.md",
      ".figma/NODE_REFERENCE.md",
      ".figma/nodes.json",
      ".figma/marwes/components/_index.json",
      ".figma/marwes/manifest.json",
      ".figma/marwes/README.md",
      ".figma/marwes/pages/-radio-button/README.md"
    ],
    "pageReferences": [
      ".figma/marwes/pages/-radio-button/-radio-button_1368-6734.json",
      ".figma/marwes/pages/-radio-button/-radio-button-dark_2276-51787.json",
      ".figma/marwes/pages/-radio-button/-radio-button-dark_2969-11557.json",
      ".figma/marwes/pages/-radio-button/-radio-button_2969-10998.json"
    ],
    "nodeReferences": {
      "radioButtonComponentSet": "1368:6733",
      "radioGroupComponent": "1368:6450",
      "radioLightFrame": "1368:6734",
      "radioDarkFrame": "2276:51787"
    },
    "figmaTokens": ["radio/surface", "radio/border", "radio/dot", "radio/label"],
    "figmaStates": {
      "baseVariants": ["radio-button", "radio-group"],
      "interactionStates": [
        "selected",
        "unselected",
        "default",
        "hover",
        "pressed",
        "disabled",
        "focus",
        "error",
        "label-right",
        "label-left",
        "light",
        "dark"
      ]
    }
  },
  "coverage": {
    "react": true,
    "vue": true,
    "svelte": true,
    "storybookReact": true,
    "storybookVue": true,
    "storybookSvelte": true,
    "contractsPresent": true,
    "auditDocPresent": true,
    "figmaReferencesPresent": true
  },
  "notes": [
    "Radio is not part of the wave-1 canonical semantic registry in @marwes-ui/core.",
    "Family-local purpose metadata currently lives in the React and Vue purpose-radio wrappers, while the raw atom and group field rely on native input[type=radio], role=radiogroup, and shared field-helper wiring.",
    "Generated from docs/registry/families/radio/registry.meta.json and scripts/generate-component-registry.ts."
  ]
}
