{
  "$schema": "../../schema/component-family.generated.schema.json",
  "family": "banner",
  "generationStatus": "generated",
  "links": {
    "referenceDocs": [
      "docs/reference/architecture.md",
      "docs/reference/spec.md",
      "docs/reference/ai-metadata.md",
      "docs/reference/testing.md",
      "docs/reference/governance.md"
    ],
    "guides": ["docs/guides/adding-components.md", "docs/guides/figma-to-marwes.md"],
    "audits": ["docs/audits/README.md"],
    "roadmap": [],
    "core": [
      "packages/core/src/components/atoms/banner/banner-a11y.ts",
      "packages/core/src/components/atoms/banner/banner-html-attributes.ts",
      "packages/core/src/components/atoms/banner/banner-option-keys.ts",
      "packages/core/src/components/atoms/banner/banner-recipe.ts",
      "packages/core/src/components/atoms/banner/banner-types.ts",
      "packages/core/src/components/atoms/banner/index.ts"
    ],
    "presets": ["packages/presets/src/firstEdition/banner.css"],
    "react": [
      "packages/react/src/components/banner/__tests__/banner.test.tsx",
      "packages/react/src/components/banner/__tests__/contract.test.tsx",
      "packages/react/src/components/banner/__tests__/index-exports.test.tsx",
      "packages/react/src/components/banner/banner.tsx",
      "packages/react/src/components/banner/index.ts",
      "packages/react/src/components/banner/variants.tsx"
    ],
    "vue": [
      "packages/vue/src/components/banner/__tests__/banner.test.ts",
      "packages/vue/src/components/banner/__tests__/contract.test.ts",
      "packages/vue/src/components/banner/banner.ts",
      "packages/vue/src/components/banner/index.ts",
      "packages/vue/src/components/banner/variants.ts"
    ],
    "svelte": [
      "packages/svelte/src/lib/components/banner/Banner.svelte",
      "packages/svelte/src/lib/components/banner/ErrorBanner.svelte",
      "packages/svelte/src/lib/components/banner/index.ts",
      "packages/svelte/src/lib/components/banner/InfoBanner.svelte",
      "packages/svelte/src/lib/components/banner/SuccessBanner.svelte",
      "packages/svelte/src/lib/components/banner/types.ts",
      "packages/svelte/src/lib/components/banner/WarningBanner.svelte"
    ],
    "storybookReact": [
      "apps/storybook-react/src/stories/banner/__tests__/banner-introduction-docs.test.ts",
      "apps/storybook-react/src/stories/banner/__tests__/banner-taxonomy.test.ts",
      "apps/storybook-react/src/stories/banner/banner.stories.tsx",
      "apps/storybook-react/src/stories/banner/Introduction.mdx"
    ],
    "storybookVue": [
      "apps/storybook-vue/src/stories/banner/__tests__/banner-introduction-docs.test.ts",
      "apps/storybook-vue/src/stories/banner/__tests__/banner-taxonomy.test.ts",
      "apps/storybook-vue/src/stories/banner/banner.stories.ts",
      "apps/storybook-vue/src/stories/banner/Introduction.mdx"
    ],
    "storybookSvelte": [
      "apps/storybook-svelte/src/stories/banner/__tests__/banner-introduction-docs.test.ts",
      "apps/storybook-svelte/src/stories/banner/__tests__/banner-taxonomy.test.ts",
      "apps/storybook-svelte/src/stories/banner/banner.stories.ts",
      "apps/storybook-svelte/src/stories/banner/BannerDarkGallery.svelte",
      "apps/storybook-svelte/src/stories/banner/BannerGallery.svelte",
      "apps/storybook-svelte/src/stories/banner/Introduction.mdx"
    ],
    "contracts": []
  },
  "semantics": {
    "coverageLevel": "canonical",
    "dataComponent": "banner",
    "canonicalAttributes": ["data-component", "data-variant"],
    "allowedPurposes": ["info-banner", "success-banner", "warning-banner", "error-banner"],
    "purposeAttributes": {
      "error-banner": {
        "data-purpose": "error-banner",
        "data-intent": "error"
      },
      "info-banner": {
        "data-purpose": "info-banner",
        "data-intent": "info"
      },
      "success-banner": {
        "data-purpose": "success-banner",
        "data-intent": "success"
      },
      "warning-banner": {
        "data-purpose": "warning-banner",
        "data-intent": "warning"
      }
    },
    "sourceOfTruthPaths": [
      "packages/core/src/semantics/family-semantics.ts",
      "packages/core/src/semantics/purpose-semantics.ts"
    ],
    "notes": [
      "Banner is a single-atom family with thin purpose variants that preset the variant prop and emit canonical data-purpose metadata."
    ]
  },
  "design": {
    "componentJsons": [".figma/marwes/components/banner.json"],
    "curatedReferences": [
      ".figma/INDEX.md",
      ".figma/NODE_REFERENCE.md",
      ".figma/nodes.json",
      ".figma/marwes/components/_index.json",
      ".figma/marwes/manifest.json",
      ".figma/marwes/README.md"
    ],
    "pageReferences": [
      ".figma/marwes/pages/-banner/-banner_1593-5094.json",
      ".figma/marwes/pages/-banner/-banner-dark_2444-2179.json",
      ".figma/marwes/pages/-banner/overall-status_1730-4164.json",
      ".figma/marwes/pages/-banner/examples_1593-7192.json"
    ],
    "nodeReferences": {
      "bannerComponent": "1593:5080",
      "bannerLightFrame": "1593:5094",
      "bannerDarkFrame": "2444:2179"
    },
    "figmaTokens": ["banner/surface", "banner/border", "banner/icon"],
    "figmaStates": {
      "baseVariants": ["neutral", "info", "success", "warning", "error"],
      "interactionStates": ["light", "dark", "with-icon", "without-icon", "with-cta", "dismissible"]
    }
  },
  "coverage": {
    "react": true,
    "vue": true,
    "svelte": true,
    "storybookReact": true,
    "storybookVue": true,
    "storybookSvelte": true,
    "contractsPresent": true,
    "auditDocPresent": false,
    "figmaReferencesPresent": true
  },
  "notes": [
    "Banner is a single-atom family with thin purpose variants that preset the variant prop and emit canonical data-purpose metadata.",
    "Generated from docs/registry/families/banner/registry.meta.json and scripts/generate-component-registry.ts."
  ]
}
