{
  "$schema": "../../schema/component-family.generated.schema.json",
  "family": "spacing",
  "generationStatus": "generated",
  "links": {
    "referenceDocs": [
      "docs/reference/architecture.md",
      "docs/reference/spec.md",
      "docs/reference/ai-metadata.md",
      "docs/reference/testing.md",
      "docs/reference/governance.md"
    ],
    "guides": ["docs/guides/adding-components.md", "docs/guides/figma-to-marwes.md"],
    "audits": ["docs/audits/README.md", "docs/audits/spacing-family-accessibility.md"],
    "roadmap": [
      "AXE_ROADMAP.md#phase-5--add-a-first-class-accessibility-support-model",
      "AXE_ROADMAP.md#p3--follow-up-family-and-system-work"
    ],
    "core": [
      "packages/core/src/components/atoms/spacing/index.ts",
      "packages/core/src/components/atoms/spacing/spacing-html-attributes.ts",
      "packages/core/src/components/atoms/spacing/spacing.recipe.ts",
      "packages/core/src/components/atoms/spacing/spacing.types.ts"
    ],
    "presets": [
      "packages/presets/src/firstEdition/spacing.css",
      "packages/presets/src/firstEdition/tokens.css"
    ],
    "react": [
      "packages/react/src/components/spacing/__tests__/spacing.test.tsx",
      "packages/react/src/components/spacing/index.ts",
      "packages/react/src/components/spacing/spacing.tsx"
    ],
    "vue": [
      "packages/vue/src/components/spacing/__tests__/spacing.test.ts",
      "packages/vue/src/components/spacing/index.ts",
      "packages/vue/src/components/spacing/spacing.ts"
    ],
    "svelte": [
      "packages/svelte/src/lib/components/spacing/index.ts",
      "packages/svelte/src/lib/components/spacing/Spacer.svelte",
      "packages/svelte/src/lib/components/spacing/Spacing.svelte",
      "packages/svelte/src/lib/components/spacing/types.ts"
    ],
    "storybookReact": [
      "apps/storybook-react/src/stories/spacing/__tests__/spacing-introduction-docs.test.ts",
      "apps/storybook-react/src/stories/spacing/__tests__/spacing-taxonomy.test.ts",
      "apps/storybook-react/src/stories/spacing/Introduction.mdx",
      "apps/storybook-react/src/stories/spacing/spacing.stories.tsx"
    ],
    "storybookVue": [
      "apps/storybook-vue/src/stories/spacing/__tests__/spacing-introduction-docs.test.ts",
      "apps/storybook-vue/src/stories/spacing/__tests__/spacing-taxonomy.test.ts",
      "apps/storybook-vue/src/stories/spacing/Introduction.mdx",
      "apps/storybook-vue/src/stories/spacing/spacing.stories.ts"
    ],
    "storybookSvelte": [
      "apps/storybook-svelte/src/stories/spacing/__tests__/spacing-taxonomy-introduction-docs.test.ts",
      "apps/storybook-svelte/src/stories/spacing/Introduction.mdx",
      "apps/storybook-svelte/src/stories/spacing/spacing.stories.ts",
      "apps/storybook-svelte/src/stories/spacing/SpacingShowcase.svelte"
    ],
    "contracts": ["tests/contracts/spacing.contract.ts"]
  },
  "semantics": {
    "coverageLevel": "family-local",
    "dataComponent": "spacing",
    "canonicalAttributes": [],
    "allowedPurposes": [],
    "purposeAttributes": {},
    "sourceOfTruthPaths": [
      "packages/core/src/components/atoms/spacing/spacing.recipe.ts",
      "packages/core/src/components/atoms/spacing/spacing.types.ts",
      "packages/presets/src/firstEdition/tokens.css"
    ],
    "notes": [
      "Spacing is not part of the wave-1 canonical semantic registry in @marwes-ui/core.",
      "The atom emits data-component=spacing and data-size directly from core, while its token scale currently comes from the shared firstEdition tokens.css file rather than a dedicated synced Figma family."
    ]
  },
  "design": {
    "componentJsons": [],
    "curatedReferences": [
      ".figma/INDEX.md",
      ".figma/NODE_REFERENCE.md",
      ".figma/nodes.json",
      ".figma/marwes/components/_index.json",
      ".figma/marwes/manifest.json",
      ".figma/marwes/README.md"
    ],
    "pageReferences": [],
    "nodeReferences": {},
    "figmaTokens": [],
    "figmaStates": {
      "baseVariants": [],
      "interactionStates": []
    }
  },
  "coverage": {
    "react": true,
    "vue": true,
    "svelte": true,
    "storybookReact": true,
    "storybookVue": true,
    "storybookSvelte": true,
    "contractsPresent": true,
    "auditDocPresent": true,
    "figmaReferencesPresent": true
  },
  "notes": [
    "Spacing is not part of the wave-1 canonical semantic registry in @marwes-ui/core.",
    "The atom emits data-component=spacing and data-size directly from core, while its token scale currently comes from the shared firstEdition tokens.css file rather than a dedicated synced Figma family.",
    "Generated from docs/registry/families/spacing/registry.meta.json and scripts/generate-component-registry.ts."
  ]
}
